{"coverage_gap_ids":["coverage:retrieval_poison","coverage:signed_request_attribution"],"issues":[],"observation":{"pack_digest":"sha256:65fdca32ce7d0c5d11a64acddc21ab4c6198642dd4a7fcd815e71eb214592c0f","schema":"ai.openbox.project-observation/v2"},"result":"no_supported_issue","schema":"ai.openbox.project-security-analysis/v1","skill":{"digest":"sha256:445b2436a943ca416fd6252dcfc43714e2575f338b12d5c339aedd536ce06041","name":"openbox-security-evaluation","version":"1.0.0"}}